{
  "change_set_id": "c5e7a9b1-3d5f-4a7c-9e1b-3d5f7a9c1e68",
  "project_id": "1c3e5a7b-9d1f-4a3c-8e5a-7b9d1f3a5c80",
  "site_id": "2d4f6b8c-0e2a-4b4d-9f6b-8c0e2a4b6d91",
  "connector": "example-cms",
  "environment": "staging",
  "plan_item_ids": ["9a1c3e5f-7b9d-4f1a-8c3e-5a7c9e1b3d57"],
  "operations": [
    {
      "op_id": "d6f8b0c2-4e6a-4b8d-8f2c-4e6a8b0d2f79",
      "plan_item_id": "9a1c3e5f-7b9d-4f1a-8c3e-5a7c9e1b3d57",
      "resource_type": "page",
      "resource_id": "1042",
      "url": "https://example.com/ar/services/web-design",
      "field": "seo.meta_description",
      "field_class": "meta_description",
      "language": "ar",
      "current_value": null,
      "proposed_value": "خدمات تصميم مواقع الشركات باللغتين العربية والإنجليزية، من التخطيط إلى الإطلاق.",
      "before_hash": "sha256:e3b0c44298fc1c149afbf4c8996fb92427ae41e4649b934ca495991b7852b855",
      "after_hash": "sha256:974e9bfef6d56b4c7865a916d402357faf2f068804aaf06dc5522b26606fccc4",
      "risk_tier": 1,
      "rationale": "SEO-002 partial: this page has no meta description.",
      "evidence_ids": ["8d4fab52-6e3c-4071-9b2f-ac5d3e7f1f24"],
      "rule_ids": ["SEO-002"],
      "idempotency_key": "chg:c5e7a9b1-3d5f-4a7c-9e1b-3d5f7a9c1e68:op:d6f8b0c2-4e6a-4b8d-8f2c-4e6a8b0d2f79",
      "status": "pending"
    }
  ],
  "requested_by_user_id": "3e5a7c9d-1f3b-4c5e-8a7c-9d1f3b5e7a02",
  "approvals": [],
  "required_approvals": 1,
  "max_risk_tier": 1,
  "mode": "edit_only",
  "publish_approval_id": null,
  "canary_op_ids": ["d6f8b0c2-4e6a-4b8d-8f2c-4e6a8b0d2f79"],
  "batch_size_max": 25,
  "snapshot_id": null,
  "approval_expires_at": null,
  "status": "AWAITING_APPROVAL",
  "status_reason_key": null,
  "auto_rollback_authorized": false,
  "idempotency_key": "chg:c5e7a9b1-3d5f-4a7c-9e1b-3d5f7a9c1e68",
  "created_at": "2026-10-02T10:05:00Z",
  "updated_at": "2026-10-02T10:07:30Z"
}
